[
  {
    "participant_id": "participant_teacher",
    "room_id": "room_demo",
    "timestamp_ms": 1000,
    "is_singing": true,
    "confidence": 0.91,
    "kind": "singing_started",
    "harmonicity": 0.88,
    "pitch_hz": 220.0
  },
  {
    "participant_id": "participant_teacher",
    "room_id": "room_demo",
    "timestamp_ms": 1120,
    "is_singing": true,
    "confidence": 0.89,
    "kind": "sample",
    "harmonicity": 0.86,
    "pitch_hz": 221.4
  },
  {
    "participant_id": "participant_teacher",
    "room_id": "room_demo",
    "timestamp_ms": 2500,
    "is_singing": false,
    "confidence": 0.84,
    "kind": "singing_stopped",
    "harmonicity": 0.12,
    "pitch_hz": null
  }
]
